Loc,Item Number,Plant Category,Plant Name
CA,28342,EVS,ABELIA GRA KALEIDOSCOPE P16988
GA,25692,EVS,ABELIA GRA ROSE CREEK
GA,400343,EVS,ABELIA SUNSHNE DAYDRM PP20961
CA,35282,EVS,AGAPANTHUS AFR SUN STRIPE R
CA,1655,EVS,AGAPANTHUS AFRICANUS
CA,1732,EVS,AGAPANTHUS BLUE STORM PP14332
GA,70372,EVS,AGAPANTHUS MOOD INDIGO
CA,1882,DCS,AGAPANTHUS X MIDKNIGHT BLUE R
CA,1885,DCS,AGAPANTHUS X MIDKNIGHT BLUE R
CT,400521,PRN,AGASTACHE HYB BLUE BOA PP24050
CA,25242,CAC,AGAVE VICTORIA-REGINAE
CT,08030UT,PRN,AJUGA CHOCOLATE CHIP
GA,00189UT,PRN,AJUGA REPTANS BRONZE BEAUTY
GA,00059UT,PRN,AJUGA REPTANS BURGUNDY GLOW
GA,00193UT,PRN,AJUGA REPTANS CATLIN'S GIANT
CT,400561,PRN,ALLIUM HYB MILLENNIUM
OR,39021,PRN,ANEMONE X WILD SWAN TM PP23132
OR,55482,PRN,ARALIA CORDATA GOTEMBA
CT,01946UT,PRN,ARMERIA MAR RUBRIFOLIA
GA,1011,PRN,ARTEMISIA SCHM SILVER MOUND
CT,28281,PRN,ASCLEPIAS GAY BUTTERFLIES
GA,3151,FRN,ASPARAGUS MYERS
GA,3152,FRN,ASPARAGUS MYERS
CT,59151,PRN,ASTILBE VISION IN PINK PP11860
GA,16341,PRN,ASTILBE VISION IN RED PP11965
GA,3562,EVS,AUCUBA MR GOLDSTRIKE
OR,3565,EVS,AUCUBA MR GOLDSTRIKE
OR,25212,GRS,BAM-FARGESIA RUFA (CLUMP)
CT,402583,GRS,BAM-FARGESIA SCABRIDA
CA,11285,GRS,BAM-PHYLLO BISSETII (RUN)
OR,23942,DCS,BER CRIMSON RUBY R PPAF
OR,12032,DCS,BER GOLDN NUGGET TM P9577 CBR
OR,080771S,DCS,BER SUNJOY R MINI SALSA PPAF
OR,12012,DCS,BER T CHERRY BOMB R CPBR 3488
OR,2242,DCS,BER T CONCORDE
OR,35231,DCS,BER T GOLDEN RUBY R PP16203
OR,35232,DCS,BER T GOLDEN RUBY R PP16203
OR,12105,DCS,BER T HELMOND PILLAR
CT,62932,DCS,BER T ORANGE ROCKET PP18411
OR,35242,DCS,BER T PYGMY RUBY TM
OR,12202,DCS,BER T ROSE GLOW
OR,12205,DCS,BER T ROSE GLOW
OR,29662,DCS,BER T ROYAL CLOAK
GA,012705PT,VIN,BOUG BARBARA KARST
CA,090122BH,VIN,BOUG BLUEBERRY ICE
GA,013265PT,VIN,BOUG OO-LA-LA R
GA,013052BH,VIN,BOUG PURPLE QUEEN R
CA,013055PT,VIN,BOUG PURPLE QUEEN R
CA,095752BH,VIN,BOUG SUNVILLEA TM PINK PP22113
CT,401181,PRN,BRUNNERA MAC SILVER HEART PPAF
CT,074412S,DCS,BUD LO&BEHLD R BLU CHP PP19991
CT,401292S,DCS,BUD LO&BEHLD R PINK MICRO CHIP
GA,077392S,DCS,BUDDLEJA MISS MOLLY PPAF
GA,074402S,DCS,BUDDLEJA X MISS RUBY PPAF
OR,3012,EVS,BUXUS CHICAGOLAND GREEN R
CT,013823CN,EVS,BUXUS GREEN MOUNTAIN
OR,13892,EVS,BUXUS GREEN VELVET
GA,13892,EVS,BUXUS GREEN VELVET
OR,13895,EVS,BUXUS GREEN VELVET
CT,13897,EVS,BUXUS GREEN VELVET
OR,13952,EVS,BUXUS J GREEN BEAUTY
GA,13952,EVS,BUXUS J GREEN BEAUTY
CA,13955,EVS,BUXUS J GREEN BEAUTY
GA,13955,EVS,BUXUS J GREEN BEAUTY
OR,13833,EVS,BUXUS MIC WINTER GEM
CT,13833,EVS,BUXUS MIC WINTER GEM
GA,13833,EVS,BUXUS MIC WINTER GEM
CA,13835,EVS,BUXUS MIC WINTER GEM
CT,13835,EVS,BUXUS MIC WINTER GEM
GA,13835,EVS,BUXUS MIC WINTER GEM
GA,013835CN,EVS,BUXUS MIC WINTER GEM
GA,13837,EVS,BUXUS MIC WINTER GEM
GA,013837CN,EVS,BUXUS MIC WINTER GEM
GA,13839,EVS,BUXUS MIC WINTER GEM
OR,13905,EVS,BUXUS S GREEN TOWER R PP15243
OR,01398UT,EVS,BUXUS SEMP SUFFRUTICOSA
OR,13981,EVS,BUXUS SEMP SUFFRUTICOSA
OR,13982,EVS,BUXUS SEMP SUFFRUTICOSA
OR,01388UT,EVS,BUXUS SEMP VARIEGATA
OR,13881,EVS,BUXUS SEMP VARIEGATA
GA,13882,EVS,BUXUS SEMP VARIEGATA
CA,022712ST,VIN,CAMPSIS BALBOA SUNSET R
CA,22715,VIN,CAMPSIS BALBOA SUNSET R
GA,29211,PRN,CANNA TROP BLACK TM PP21350
GA,17411,PRN,CANNA TROPICANNA GLD TM P13809
GA,22481,PRN,CANNA TROPICANNA TM PP10569
CA,92892,DCS,CARY CLA KORBALL BLU BALLOON R
GA,57382,EVS,CESTRUM AUR ORANGE PEEL
OR,24032,CON,CHAM PIS FIL GOLDEN CHARM
CT,82455,CON,CHAM PIS GOLDEN MOP
OR,39512,PRN,CIMI S BLACK NEGLIGEE (ACTAEA)
CT,024752PT,CIT,CITRUS BEARSS SEEDLESS LIME
CT,24742,CIT,CITRUS DWF BEARSS SEEDLSS LIME
CT,026002PT,CIT,CITRUS IMPROVED MEYER LEMON
CT,025602PT,CIT,CITRUS KUMQUAT NAGAMI
CT,026602PT,CIT,CITRUS OWA SATSUMA MANDARIN
CT,026052PT,CIT,CITRUS WASHINGTON NAVEL ORANGE
OR,27431,VIN,CLEM MONTANA FREDA
OR,21862,VIN,CLEM SAPPHIRE INDIGO TMPP17012
OR,21865,VIN,CLEM SAPPHIRE INDIGO TMPP17012
OR,27221,VIN,CLEM X COMTESSE DE BOUCHAUD
OR,27261,VIN,CLEM X JACKMANII
GA,27532,DCS,CLETHRA ALN RUBY SPICE
GA,24175,PRN,COLOCASIA ANT ILLUSTRIS
GA,408501,PRN,COLOCASIA RYL HWN R BK CRL PAF
GA,408505,PRN,COLOCASIA RYL HWN R BK CRL PAF
GA,408495,PRN,COLOCASIA RYL HWN R HAWAN PNCH
GA,412585,PRN,COLOCASIA RYL HWN R MAUI GOLD
CA,31731,EVS,CORD FESTIVAL TM BRGNDY P14224
GA,31721,EVS,CORDYLINE BAUERI
CA,31725,EVS,CORDYLINE BAUERI
CA,31701,EVS,CORDYLINE INDIVISA
GA,31701,EVS,CORDYLINE INDIVISA
OR,28552,DCS,COT APICULATUS TOM THUMB
OR,28145,DCS,COTINUS COG ROYAL PURPLE
CT,35355,CON,CRYPTOMERIA J BLACK DRAGON
GA,30519,CON,CUP LEY EMERALD ISLE R
GA,30509,CON,CUP LEYLANDII
GA,30491,PRN,CUPHEA HYSSOPIFOLIA
CA,88912,PRN,CYNARA SCO GREEN GLOBE
OR,029892S,DCS,DEUTZIA CHRDNY PERLS R PP16098
CT,029893S,DCS,DEUTZIA CHRDNY PERLS R PP16098
OR,91882,DCS,DEUTZIA X NIKKO BLUSH NA74356
GA,59681,PRN,DIANTHUS FIRE STAR PP14895
GA,31331,PRN,DIANTHUS FROSTY FIRE
CT,4721,PRN,DIANTHUS GRAT FIREWITCH
CT,85821,PRN,DISPORUM CANT MOONLIGHT P24556
GA,22831,PRN,ECHINACEA CRNBRY CUPCAKE PPAF
CA,62005,PRN,ENSETE MAURELII
GA,62005,PRN,ENSETE MAURELII
CA,62009,PRN,ENSETE MAURELII
GA,74341,PRN,ERYNGIUM PLANUM BLUE HOBBIT
CT,33605,DCS,EUO ALATUS COMPACTUS
CA,03540MES,EVS,EUO KIA MANHATTAN
CA,035405ES,EVS,EUO KIA MANHATTAN
OR,46682,PRN,EUPATORIUM PHANTOM PP18354
CA,035572PT,EVS,EURYOPS PECT VIRIDIS
CA,035575PT,EVS,EURYOPS PECT VIRIDIS
GA,35641,EVS,FATSIA JAPONICA
GA,83621,FRN,FERN-ADIANTUM PEDATUM
GA,35905,FRN,FERN-ALSOPHILA AUSTRALIS
GA,19241,FRN,FERN-ATHYRIUM F LADY IN RED
CA,19242,FRN,FERN-ATHYRIUM F LADY IN RED
GA,18761,FRN,FERN-ATHYRIUM GHOST
CA,18762,FRN,FERN-ATHYRIUM GHOST
GA,36121,FRN,FERN-ATHYRIUM NIP PICTUM
CA,36122,FRN,FERN-ATHYRIUM NIP PICTUM
GA,44541,FRN,FERN-ATHYRIUM PWTR LACE P15721
GA,5041,FRN,FERN-DRYOPTERIS CELSA
CT,21221,FRN,FERN-DRYOPTERIS ERY BRILLIANCE
OR,21222,FRN,FERN-DRYOPTERIS ERY BRILLIANCE
GA,36241,FRN,FERN-DRYOPTERIS ERYTHROSORA
OR,36262,FRN,FERN-DRYOPTERIS FELIX-MAS ROB
GA,21231,FRN,FERN-DRYOPTERIS X AUSTRALIS
OR,36451,FRN,FERN-MATTEUCCIA STRUTHIOPTERIS
OR,36452,FRN,FERN-MATTEUCCIA STRUTHIOPTERIS
CA,36452,FRN,FERN-MATTEUCCIA STRUTHIOPTERIS
OR,36455,FRN,FERN-MATTEUCCIA STRUTHIOPTERIS
CT,36411,FRN,FERN-OSMUNDA CINNAMOMEA
GA,83721,FRN,FERN-POLYSTICHUM POLYBLEPHARUM
OR,83722,FRN,FERN-POLYSTICHUM POLYBLEPHARUM
OR,36492,FRN,FERN-POLYSTICHUM SET(ANGULARE)
GA,5091,FRN,FERN-THELYPTERIS DECUR-PINNATA
CA,36725,TRE,FICUS CAR BLACK JACK
GA,36725,TRE,FICUS CAR BLACK JACK
CA,36785,TRE,FICUS CAR BROWN TURKEY
CA,36795,TRE,FICUS CAR KADOTA
CA,36815,TRE,FICUS CAR MISSION
CA,36745,TRE,FICUS CAR PETERS HONEY
CT,31415,DCS,FOTHERGILLA MAJ BLU SHADOW PAF
CT,37185,DCS,FOTHERGILLA MAJ MOUNT AIRY
OR,86091,PRN,FRAGARIA X ANANASSA TOSCANA
GA,02383UT,PRN,GALIUM ODORATUM
GA,097912S,EVS,GARDENIA PINWHEEL R PP22510
OR,17611,EVS,GAULTHERIA RED BARON
GA,35681,PRN,GAURA L WHIRLING BUTTERFLIES
GA,36481,PRN,GAURA PASSIONATE RAINBW P17002
GA,67791,GRS,GR-BOUT BLOND AMBITION PP22048
OR,22591,GRS,GR-CAREX ELATA BOWLES GOLDEN
GA,28045,GRS,GR-CORT IVORY FEATHERS R
GA,36671,GRS,GR-FESTUCA GLAUCA ELIJAH BLUE
CT,35911,GRS,GR-HAKONECHLOA MACRA ALL GOLD
CT,38681,GRS,GR-HAKONECHLOA MACRA AUREOLA
CT,61743,GRS,GR-MIS SIN CABARET
OR,5455,GRS,GR-MIS SIN DIXIELAND
GA,61563,GRS,GR-MIS SIN GRACILLIMUS
CA,61565,GRS,GR-MIS SIN GRACILLIMUS
CA,61665,GRS,GR-MIS SIN MORNING LIGHT
CT,61553,GRS,GR-MIS SIN STRICTUS
GA,61575,GRS,GR-MIS SIN VARIEGATUS
CA,61645,GRS,GR-MIS SIN YAKUSHIMA
GA,63883,GRS,GR-PAN VIR SHENANDOAH
CT,64263,GRS,GR-PENN ALO HAMELN
CA,64271,GRS,GR-PENN SET RUBRUM
GA,64275,GRS,GR-PENN SET RUBRUM
CT,039991S,PRN,HELLE X IVORY PRINCE PP16199
CT,403061S,PRN,HELLEBORUS HYB MERLIN
OR,75431,PRN,HELLEBORUS X DOUBLE FANTASY
CT,40631,PRN,HEM PRAIRIE BLUE EYES
OR,76281,PRN,HEM RUBY SPIDER
CT,83931,PRN,HEM SWIRLING WATER
GA,23101,PRN,HEUCHERA FROSTED VIOLET P15085
CA,47531,PRN,HEUCHERA GEORGIA PEACH PP19375
CT,18661,PRN,HEUCHERA GREEN SPICE
CT,074493S,DCS,HIB SYR LIL' KIM TM PP19547
CT,31872,PRN,HOSTA ABIQUA DRINKING GOURD
OR,41771,PRN,HOSTA GOLDEN PRAYERS
GA,28391,PRN,HOSTA OLIVE BAILEY LANGDON
CT,403621,PRN,HOSTA PRAYING HANDS
OR,39471,PRN,HOSTA ROSEDALE GOLDEN GOOSE
CA,92755,DCS,HYD BLUE ENCHANTRESS R PP25209
GA,92755,DCS,HYD BLUE ENCHANTRESS R PP25209
CT,403803,DCS,HYD END SUM R BLMSTRCK TM PPAF
GA,17315,DCS,HYD M ENDLESS SUMMER R PP15298
GA,074542S,DCS,HYD MAC CTYLN TM RIO
CT,403872S,DCS,HYD MAC ELECTRIC ROUGE TM
CA,77465,DCS,HYD MAC LD R BIG EASY PPAF
GA,77465,DCS,HYD MAC LD R BIG EASY PPAF
CT,086303S,DCS,HYD MAC LD R DIVA
CT,086313S,DCS,HYD MAC LD R RHYTHMIC BLUE PAF
GA,41965,DCS,HYD MAC NIKKO BLUE
CA,23755,DCS,HYD MAC PENNY MAC
GA,23755,DCS,HYD MAC PENNY MAC
CA,42072,DCS,HYD MAC PINK ELF R (PIA)
CT,089953S,DCS,HYD P LITTLE QUICK FIRE R PPAF
GA,89945,DCS,HYD PAN FIRE LIGHT TM PPAF
CT,074607PT,DCS,HYD PAN QUICK FIRE R PP16812
CT,404023,DCS,HYD PAN SWEET SUMMER PP21778
OR,35011,VIN,HYD PET MIRANDA
OR,35015,VIN,HYD PET MIRANDA
OR,41702,VIN,HYD PETIOLARIS
CT,41702,VIN,HYD PETIOLARIS
OR,41705,VIN,HYD PETIOLARIS
CT,93173,DCS,HYD QUER MUNCHKIN
CT,42045,DCS,HYD QUER SNOWFLAKE
OR,080962S,DCS,HYD SER TUFF STUFF TM PPAF
CA,65381,DCS,HYPERICUM AN IGNITE RED P19468
GA,404083,DCS,HYPERICUM IGNITE SCR RD P18801
CA,080892S,DCS,HYPERICUM K BLUES FSTVL TM PAF
CT,42201,PRN,IBERIS SEMP SNOWFLAKE
GA,44935,EVS,ILEX CREN SKY PENCIL(SKY SNTRY
GA,44937,EVS,ILEX CREN SKY PENCIL(SKY SNTRY
CT,45693,DCS,ILEX V SOUTHERN GENTLEMAN(MALE
CT,74935,DCS,ILEX VERT BERRY NICE R
CT,45133,EVS,ILEX X BERRI-MAGIC R ROYALTY
CT,14883,EVS,ILEX X EMERALD MAGIC PP12314
OR,23967,EVS,ILEX X SANTA'S DELIGHT R
OR,46875,CON,JUN C BLUE POINT
CA,46875,CON,JUN C BLUE POINT
GA,46877,CON,JUN C BLUE POINT
OR,48135,CON,JUN C SEA OF GOLD R PP17622
CA,48135,CON,JUN C SEA OF GOLD R PP17622
CA,47307,CON,JUN C SPARTAN
GA,49102,CON,JUN CON BLUE PACIFIC
OR,49252,CON,JUN H BLUE CHIP
OR,50702,CON,JUN H WILTONII
GA,50902,CON,JUN PRO NANA
OR,05330M,CON,JUN SC WICHITA BLUE
OR,53305,CON,JUN SC WICHITA BLUE
CA,53305,CON,JUN SC WICHITA BLUE
OR,53391,CON,JUN SQUA BLUE STAR
OR,53392,CON,JUN SQUA BLUE STAR
CA,54705,DCS,LAG CATAWBA
GA,41905,DCS,LAG CHERRY DAZZLE R PP16917
GA,008869BH,DCS,LAG DYNAMITE R P10296
GA,8899,DCS,LAG MUSKOGEE
GA,8999,DCS,LAG NATCHEZ
CT,404362,DCS,LAG PURPLE MAGIC TM PPAF
GA,40705,DCS,LAG RASPBERRY DAZZLE R PP17216
GA,009029BH,DCS,LAG RED ROCKET R PP11342
GA,9037,DCS,LAG TUSCARORA
GA,9039,DCS,LAG TUSCARORA
GA,56611,PRN,LANTANA CAM AMERICAN RED
GA,56641,PRN,LANTANA CAM MARY ANN
GA,9131,PRN,LANTANA CAM MOZELLE
GA,009133PT,PRN,LANTANA CAM MOZELLE
GA,056633PT,PRN,LANTANA CHAPEL HILL YLW P19548
GA,056953PT,PRN,LANTANA CONFETTI TM
GA,9091,PRN,LANTANA NEW GOLD
GA,009093PT,PRN,LANTANA NEW GOLD
GA,057231SPT,PRN,LANTANA S LAVENDER SWIRL R
GA,057153PT,PRN,LANTANA SUNBURST TM
GA,057203PT,PRN,LANTANA TANGERINE TM
CA,24461,PRN,LANTANA TEENIE GENIE R PP17612
GA,24461,PRN,LANTANA TEENIE GENIE R PP17612
OR,79932,EVS,LAURUS NOB LITTLE RAGU TM PPAF
CA,05729EPT,EVS,LAURUS NOBILIS
CA,057295PT,EVS,LAURUS NOBILIS
CT,60321,PRN,LEUCOSCEPTRUM JAP GOLDEN ANGEL
CA,058205P2,EVS,LIGUSTRUM TEXANUM
GA,36541,GRS,LIRIOPE EMRLD GODDESS R P15471
GA,58921,GRS,LIRIOPE SPICATA SILVER DRAGON
OR,059055ST,VIN,LONICERA JAP HALLIANA
CA,059055ST,VIN,LONICERA JAP HALLIANA
GA,60439,TRE,MAG G BRACKENS BROWN BEAUTY
GA,59439,TRE,MAG G LITTLE GEM
GA,60905,EVS,MAHONIA BEALEI
GA,61201,VIN,MAN ALICE DU PONT
GA,61205,VIN,MAN ALICE DU PONT
GA,85801,VIN,MAN BRIDE'S CASCADE PPAF
GA,61191,VIN,MAN PNK PRFT R P11787-P6300547
GA,09238UT,VIN,MAN SUN PAR R GARDEN CRIMSON
CA,57085,VIN,MAN SUN PAR R GIANT PNK P15202
GA,57065,VIN,MAN SUN PAR R GNT WHITE P11556
CA,61291,VIN,MAN TANGO TWIRL R P14290
GA,61291,VIN,MAN TANGO TWIRL R P14290
CT,38512,CON,MICROBIOTA DRWS BLUE TM P20298
OR,38502,CON,MICROBIOTA FUZZBALL TM P20012
CA,060085TR,TRE,OLEA HAAS IMP MANZANILLO (FRT)
CA,06304EPT,EVS,OLEA LITTLE OLLIE R
GA,63111,GRS,OPHIOPOGON EBONY KNIGHT TM
CT,404962,PRN,PAEONIA ITOH FIRST ARRIVAL
CT,81072,PRN,PAEONIA OFF RUBRA PLENA
OR,24242,PRN,PAEONIA X BLAZE (RED)
CT,19522,PRN,PAEONIA X BOWL OF BEAUTY (PK)
CT,404932,PRN,PAEONIA X DUCHESSE DE NEMOUR
CT,63572,PRN,PAEONIA X KARL ROSENFIELD(RED)
CT,404952,PRN,PAEONIA X PINK HAWAIAN CORAL
CT,39662,PRN,PAEONIA X PRIMEVERE (WHITE)
OR,46072,PRN,PAEONIA X RASPBERRY SUNDAE(PK)
CT,46072,PRN,PAEONIA X RASPBERRY SUNDAE(PK)
CA,2581,VIN,PARTH TRI GREEN SHOWERS
CA,2585,VIN,PARTH TRI GREEN SHOWERS
CT,64451,PRN,PHLOX SUB EMERALD BLUE
CT,91041,PRN,PHLOX SUB EMERALD PINK
CT,62561,PRN,PHLOX SUBULATA FORT HILLS
CT,029943S,DCS,PHYSOCARPUS SUMR WINE R P14821
OR,64552,CON,PICEA ABIES LITTLE GEM
OR,64582,CON,PICEA ABIES PUMILA
CT,06462M,CON,PICEA GL CONICA
OR,64621,CON,PICEA GL CONICA
OR,64622,CON,PICEA GL CONICA
OR,064622P3,CON,PICEA GL CONICA
CT,64625,CON,PICEA GL CONICA
OR,064625SP,CON,PICEA GL CONICA
OR,06478M,CON,PICEA PUN GLAUCA FAT ALBERT
OR,64785,CON,PICEA PUN GLAUCA FAT ALBERT
OR,06469M,CON,PICEA PUN GLOBOSA
OR,64695,CON,PICEA PUN GLOBOSA
OR,06476M,CON,PICEA PUN MOERHEIM
OR,65162,EVS,PIERIS J LITTLE HEATH
OR,49492,EVS,PIERIS J TIKI
OR,65455,CON,PINUS MUGO PUMILIO
GA,66371,EVS,PLUMBAGO ROYAL CAPE R
GA,66375,EVS,PLUMBAGO ROYAL CAPE R
GA,066375PT,EVS,PLUMBAGO ROYAL CAPE R
GA,66361,EVS,PLUMBAGO WHITE CAPE R PP13953
CT,405411,PRN,POLYGONATUM MULTIFLORUM
OR,86652,DCS,POTENTILLA PINK BEAUTY P9874
OR,66742,DCS,POTENTILLA SUNSET
OR,67172,EVS,PRUNUS LAUR SCHIPKAENSIS
OR,67175,EVS,PRUNUS LAUR SCHIPKAENSIS
OR,67055,EVS,PRUNUS LAUROCERASUS
CT,407507,TRE,"PRUNUS X SNOW FOUNTAIN TM 36"""
CA,68012,DCS,PUNICA GR ANGEL RED R PP16578
CA,67701,EVS,PYRACANTHA ANG YUKON BELLE R
GA,36292,ROS,ROSA FLWR CAR R AMBER PPAF
CA,036295PT,ROS,ROSA FLWR CAR R AMBER PPAF
CA,69292,ROS,ROSA FLWR CAR R APLBLSM P10239
CA,069785PT,ROS,ROSA FLWR CAR R PINK
CA,79572,ROS,ROSA FLWR CAR R PNK SPLSH PPAF
CA,36382,ROS,ROSA FLWR CAR R PNK SUP P16276
GA,36312,ROS,ROSA FLWR CAR R SCARLET P17373
CA,036315PT,ROS,ROSA FLWR CAR R SCARLET P17373
CA,70212,ROS,ROSA FLWR CAR R WHITE P9573
CA,070215PT,ROS,ROSA FLWR CAR R WHITE P9573
CT,042823S,ROS,ROSA KNCK OUT R DBL PNK P18507
GA,042825PT,ROS,ROSA KNCK OUT R DBL PNK P18507
CT,030903S,ROS,ROSA KNCK OUT R DBL RD P16202
CT,011623S,ROS,ROSA KNCK OUT R P11836 (RED)
GA,011623S,ROS,ROSA KNCK OUT R P11836 (RED)
GA,011625PT,ROS,ROSA KNCK OUT R P11836 (RED)
GA,022153S,ROS,ROSA KNCK OUT R P15070 (PINK)
GA,022155PT,ROS,ROSA KNCK OUT R P15070 (PINK)
CT,406253,ROS,ROSA PEACHY KEEN PPAF
CA,090795ST,ROS,ROSA-CL-CECILE BRUNNER
GA,62691,EVS,ROSMARINUS BLUE SPIRES
CA,07028EPT,EVS,ROSMARINUS OFF TUSCAN BLUE
CA,70281,EVS,ROSMARINUS OFF TUSCAN BLUE
GA,41361,EVS,ROSMARINUS ROMAN BTY PP18192
OR,70612,DCS,SALIX INTEGRA HAKURO NISHIKI
GA,34921,PRN,SALVIA GAUR BLACK & BLUE
CA,94291,PRN,SALVIA HTWV BLAST TM PP24153
OR,035942S,DCS,SAMBUCUS BLACK LACE TM PP15575
OR,019992S,DCS,SAMBUCUS BLK BEAUTY TM PP12305
OR,70501,EVS,SARCOCOCCA HUMILIS
OR,70502,EVS,SARCOCOCCA HUMILIS
OR,43465,VIN,SCHIZOPHRAGMA ELLIP 8170 DJHV8
OR,07094UT,PRN,SEDUM BRONZE CARPET
CT,00730UT,PRN,SEDUM SSPRKLR R LIME ZNGR PPAF
GA,06550UT,PRN,SEMPERVIVUM ARACHNOIDEUM
GA,06559UT,PRN,SEMPERVIVUM BLACK
GA,06560UT,PRN,SEMPERVIVUM GREEN WHEEL
GA,06598UT,PRN,SEMPERVIVUM HARDY MIX
GA,06561UT,PRN,SEMPERVIVUM KREBS DES ROSE
GA,06563UT,PRN,SEMPERVIVUM RED RUBIN
OR,71051,EVS,SKIMMIA JAPONICA-FEMALE
OR,71052,EVS,SKIMMIA JAPONICA-FEMALE
OR,71061,EVS,SKIMMIA JAPONICA-MALE
OR,71062,EVS,SKIMMIA JAPONICA-MALE
OR,71081,EVS,SKIMMIA REEVESIANA
OR,71082,EVS,SKIMMIA REEVESIANA
CT,075013S,DCS,SPIRAEA DBLPLAY R ARTIST PPAF
CT,075033S,DCS,SPIRAEA DBLPLAY R BIGBANG PPAF
OR,075022S,DCS,SPIRAEA DBLPLAY R GOLD PPAF
OR,71222,DCS,SPIRAEA JAP ALPINA
CT,71173,DCS,SPIRAEA X GOLDFLAME
OR,71232,DCS,SPIRAEA X LIMEMOUND R
OR,074685PT,DCS,SYRINGA BLOOMERNG R PUR P20575
CT,72023,DCS,SYRINGA PATULA MISS KIM
CT,406923,DCS,SYRINGA V TINY DANCER TM
OR,28425,DCS,SYRINGA X DECLARATION NA62975
CA,072215PT,EVS,TABERNAEMONTANA FLORE PLENO
GA,12597,CON,THUJA GREEN GIANT
OR,12599,CON,THUJA GREEN GIANT
GA,12599,CON,THUJA GREEN GIANT
OR,73015,CON,THUJA OC EMERALD
CA,066305PT,EVS,TIBOUCHINA URVILLEANA
GA,56232,DCS,VACC BOUNTIFUL BLUE R PP19381
GA,73461,PRN,VERBENA X PURPLE SPREADER TM
OR,74065,DCS,VIB PLI T MARIESI
CT,74065,DCS,VIB PLI T MARIESI
CT,73995,DCS,VIB PLI T SHOSHONI
CT,407205,DCS,VIBURNUM PLI T POPCORN
OR,76081,PRN,VINCA MINOR ATROPURPUREA
OR,07613UT,PRN,VINCA MINOR BOWLES'
OR,76131,PRN,VINCA MINOR BOWLES'
CT,077513S,DCS,WEIGELA FL SPILLED WINE TM PAF
CT,076563S,DCS,WEIGELA FL WINE&ROSES R P10772
CA,76775,VIN,WISTERIA FL TEXAS PURPLE
CT,76815,VIN,WISTERIA FRU AMETHYST FALLS
CA,90152,EVS,YUCCA FIL COLOR GUARD
,,,Totals:
