item,Description
066382,ALST ROCK & ROLL R PP21001
414532TE,CLEM BLVRD R NINON TM PPAF
030737,CUP SEMP TINY TOWER R PP12933
085821,DISPORUM CANT MOONLIGHT P24556
064182,HESPERALOE BRK LIGHTS R P21729
092657P3,ILEX EMRLD COLONNADE R PP23905
021092,ILEX X SCALLYWAG TM PP21941
047602PP,JUN C HETZII GLAUCA
047305SP,JUN C SPARTAN
050905PT,JUN PRO NANA
079932,LAURUS N LITTLE RAGU R P25915
049492,PIERIS J TIKI
016582,PITT TEN GOLF BALL P15329
086559,PODOCARPUS ICEE BLUE R(BL CHIP
080005,POLYSPORA LONG FULLMOON R PPAF
046752,RHAPH U RUTRHAPH STHRN MOON TM
046757,RHAPH U RUTRHAPH STHRN MOON TM
049955,SCHEFFLERA TAIW YUAN SHAN
05393M,THUJA OC HIGHLIGHTS TM PP21967
055142,THUJA X EMBER WAVES R PP25363
072405,THUJA X TINY TOWER R PPAF
408117PX,TOP HAT # 5
051322,TSUGA C GLDN DUCHESS R PP25503
097392,VACCINIUM X PERPETUA TM P24209
