Loc,New Plant,Item,Size,Plant Name,
OR,2012,051275ST,#5 STAKED,CEDRUS FEELIN SUNNY TM PP23886,
OR,2011,024662,#2,CEPHALOTAXUS HAR DUKE GARDENS,
OR,    ,024032,#2,CHAM PIS FIL GOLDEN CHARM,
GA,    ,030519,#15,CUP LEY EMERALD ISLE R,
CA,    ,048135,#5,JUN C SEA OF GOLD R PP17622,
OR,    ,049902,#2,JUN H ICEE BLUE R P9639,
CA,    ,053659,#15,JUN V BLUE ARROW,
OR,2011,036165,#5,METASEQUOIA G OGON GOLD RUSH,
OR,2012,038502,#2,MICROBIOTA FUZZBALL TM P20012,
OR,    ,064545,#5,PICEA ABIES CUPRESSINA,
OR,2013,052552,#2,PICEA ABIES PUSCH,
OR,    ,064642,#2,PICEA GL ALBERTA BLUE P11473,
OR,2012,019371,#1,PICEA GL CONICA TINY TOWER R,
OR,2010,021532,#2,PICEA OMORIKA PIMOKO,
OR,2014,04761M,#10 Squat,PICEA OMORIKA SKY TRAILS,
OR,2012,04463M,#10 Squat,PICEA PUN ISELI FASTIGATE,
OR,2010,01939M,#10 Squat,PICEA PUN THE BLUES,
OR,2013,047375,#5,PICEA PUN THOMPSENII,
OR,    ,02154M,#10 Squat,PINUS KOR SILVERAY,
OR,    ,01941M,#10 Squat,PINUS NIGRA OREGON GREEN,
OR,    ,072342,#2,TAXUS EMERALD SPREADR R P10335,
OR,2011,047445PT,#5 PATIO TREE,THUJA OC FIRE CHIEF TM P19009,
GA,    ,001885,#5,AGAPANTHUS X MIDKNIGHT BLUE R,
OR,    ,02394M,#10 Squat,BER CRIMSON RUBY R PPAF,
OR,2014,080772S,SuperTwo,BER SUNJOY R MINI SALSA PPAF,
OR,    ,03523M,#10 Squat,BER T GOLDEN RUBY R PP16203,
OR,2010,035242,#2,BER T PYGMY RUBY TM,
GA,2011,077412S,SuperTwo,BUD LO&BEHLD R PRPL HAZE PPAF,
GA,2012,077392S,SuperTwo,BUDDLEJA MISS MOLLY PPAF,
CA,2010,092895,#5,CARY CLA KORBALL BLU BALLOON R,
CA,2011,074452S,SuperTwo,CHAEN DBLTKE TM PK STRM P20920,
CA,2011,074771S,SuperOne TM,CHAEN DBLTKE TM SCR STRM PPAF,
OR,    ,044705,#5,CORNUS SERICEA KELSEYI,
OR,    ,029892S,SuperTwo,DEUTZIA CHRDNY PERLS R PP16098,
OR,2011,056425,#5,DEUTZIA SET CORYMBIFLORA,
OR,    ,017545,#5,FORSYTHIA X MAGICAL R GOLD,
GA,2011,074502S,SuperTwo,HIB SYR BLU CHIFFON TM PP20574,
CA,2011,074842S,SuperTwo,HIB SYR CHINA CHIFFON TM PPAF,
CA,    ,016962S,SuperTwo,HIB SYR LAV CHIFFON TM PP12619,
GA,2011,074492S,SuperTwo,HIB SYR LIL' KIM TM PP19547,
GA,2012,077445,#5,HYD ABRACADABRA TM ORB PP21635,
OR,2013,063832,#2,HYD ANG GOLDEN CRANE R,
GA,2011,074522S,SuperTwo,HYD ARB INCREDIBALL R PP20571,
CA,2011,019215,#5,HYD ARB WHITE DOME R PP14168,
OR,2013,056452,#2,HYD ASPERA PLUM PASSION R,
GA,2013,092755,#5,HYD M ENCHANTRESS R PPAF,
GA,2012,077465,#5,HYD MAC LD R BIG EASY PPAF,
GA,2014,089932S,SuperTwo,HYD MAC PARAPLU TM PPAF,
GA,2014,089951S,SuperOne TM,HYD P LITTLE QUICK FIRE R PPAF,
GA,2012,080955,#5,HYD PAN BOBO R PP22782,
GA,2014,089945,#5,HYD PAN FIRE LIGHT TM PPAF,
GA,    ,024375,#5,HYD PAN LIMELIGHT PP12874,
GA,    ,029922S,SuperTwo,HYD PAN LITTLE LIME PPAF,
GA,2011,074615,#5,HYD PAN PINKY WINKY TM PP16166,
OR,2011,074605,#5,HYD PAN QUICK FIRE R PP16812,
GA,2013,080962S,SuperTwo,HYD SER TUFF STUFF TM PPAF,
CA,2013,065385,#5,HYPERICUM AN IGNITE RED P19468,
GA,2011,074625,#5,HYPERICUM SUNNY BLVD TM P20045,
GA,    ,054709BH,#15 BUSH,LAG CATAWBA,
GA,    ,008869BH,#15 BUSH,LAG DYNAMITE R P10296,
GA,    ,008899,#15 CLUMP,LAG MUSKOGEE,
GA,    ,008999,#15 CLUMP,LAG NATCHEZ,
GA,    ,009039,#15 CLUMP,LAG TUSCARORA,
GA,    ,056359,#15 CLUMP,LAG X TONTO,
CA,    ,020772,#2,LEPTODERMIS OBLONGA,
CA,    ,059585TR,#5 TREE,MAG X BLACK TULIP PPAF,
OR,2013,068265,#5,PHYSOCARPUS OPU DART'S GOLD,
CA,2010,068015,#5,PUNICA GR SMITH ANGLRD PP16578,
GA,2013,079382,#2,RUBUS RSPBRY SHRTCKE TM P22141,
OR,2011,075012S,SuperTwo,SPIRAEA DBLPLAY R ARTIST PPAF,
OR,2011,075021S,SuperOne TM,SPIRAEA DBLPLAY R GOLD PPAF,
CA,2011,074682S,SuperTwo,SYRINGA BLOOMERNG R PUR P20575,
OR,    ,028425,#5,SYRINGA X DECLARATION NA62975,
OR,2010,056235,#5,VACC BOUNTIFUL BLUE R PP19381,
CA,2013,081712,#2,VACCINIUM PEACH SORBET TM PPAF,
OR,    ,073975,#5,VIB PLI T SUMMER SNOWFLAKE,
OR,    ,076395,#5,WEIGELA FL DARK HORSE PP14381,
OR,2011,074692S,SuperTwo,WEIGELA FL FINE WINE TM P18513,
OR,2011,077512S,SuperTwo,WEIGELA FL SPILLED WINE TM PAF,
OR,    ,076565,#5,WEIGELA FL WINE&ROSES R P10772,
OR,    ,017575,#5,WEIGELA MAGICAL R FNTSY P13567,
GA,    ,028343,#3,ABELIA GRA KALEIDOSCOPE P16988,
OR,    ,003015,#5,BUXUS CHICAGOLAND GREEN R,
OR,2011,090782,#2,BUXUS GOLDEN TRIUMPH,
GA,    ,013955,#5,BUXUS J GREEN BEAUTY,
CA,2014,077421S,SuperOne TM,BUXUS MIC WEDDING RING TM PPAF,
CA,    ,013835,#5,BUXUS MIC WINTER GEM,
OR,    ,013902,#2,BUXUS S GREEN TOWER R PP15243,
OR,2011,057382,#2,CESTRUM AUR ORANGE PEEL,
GA,    ,044095,#5,GARDENIA FROSTPROOF,
GA,2011,092657,#7,ILEX EMRLD COLONNADE R PP23905,
OR,    ,045112,#2,ILEX GLA NORDIC TM,
OR,2012,074952S,SuperTwo,ILEX X CASTLE SPIRE R PP14310,
OR,2012,074942S,SuperTwo,ILEX X CASTLE WALL TM PP14308,
GA,    ,019655,#5,ILEX X RED BEAUTY R PP14750,
OR,    ,023967,#7,ILEX X SANTA'S DELIGHT R,
OR,2011,021093,#3,ILEX X SCALLYWAG TM PP21941,
GA,    ,037425,#5,LORO C EVER RED R,
CA,    ,040202,#2,LORO C PIPA'S RED,
CA,    ,059235,#5,LORO C RUBRUM RAZZLEBERRI R,
GA,    ,059193,#3,LORO C SIZZLING PINK,
CA,2011,098405,#5,LORO C SNOW PANDA,
GA,    ,009933,#3,LORO C SUZANNE,
CA,    ,009941,#1,LORO C ZHUZHOU FUCHSIA,
OR,    ,060952,#2,MAHONIA REPENS,
OR,    ,062225,#5,NAND D SIENNA SUNRISE R P14693,
OR,    ,062125,#5,NAND DOM GULF STREAM,
OR,    ,065225,#5,PIERIS TAIWAN PRELUDE,
OR,    ,019095,#5,PRUNUS LAUR ETNA,
OR,    ,067101,#1,PRUNUS LAUR MT VERNON,
CA,    ,039825,#5,PYRACANTHA X SLVRLNG TM P15517,
OR,    ,020491,#1,ROSMARINUS OFF ARP,
OR,2011,036642,#2,SARCOCOCCA HOOK DIGYNA,
OR,    ,071082,#2,SKIMMIA REEVESIANA,
GA,2012,078762S,SuperTwo,AZ BLM-A-THON TM DB PK PP21477,
GA,2013,078771S,SuperOne TM,AZ BLM-A-THON TM RED PP21562,
GA,2013,078782S,SuperTwo,AZ BLM-A-THON TM WHITE PP21512,
OR,    ,030462,#2,RHOD (H-1) ELVIIRA,
OR,    ,018012,#2,RHOD (H-1) HAAGA,
OR,    ,030215,#5,RHOD (H-1) MIKKELI,
OR,2010,019775,#5,RHOD (H-1) RTR HOOPLA,
OR,2013,020195,#5,RHOD (H-1) RTR MARCH MADNESS,
OR,    ,019742,#2,RHOD (H-1) RTR SLAM DUNK,
OR,2011,019892,#2,RHOD (H-1) WOJNAR'S PURPLE,
OR,    ,010202,#2,RHOD (H-2) SCARLET WONDER DWRF,
OR,    ,010191,#1,RHOD (H-2) SNEEZY,
OR,    ,009492,#2,RHOD (H-3) HOTEI,
OR,2010,026385,#5,RHOD (H-3) RAC ROCK ROSE,
OR,    ,010295,#5,RHOD (H-3) TAURUS,
CA,2013,079572,#2,ROSA FLWR CAR R PNK SPLSH PPAF,
GA,2011,074962S,SuperTwo,ROSA OSO EASY R CHERRYPIE PPAF,
GA,2011,075002S,SuperTwo,ROSA OSO EASY R HONEY BUN PPAF,
CA,2013,080721S,SuperOne TM,ROSA OSO EASY R MNGO SALSA PAF,
CA,2011,074982S,SuperTwo,ROSA OSO EASY R PAPRIKA PPAF,
OR,2013,080731S,SuperOne TM,ROSA OSO EASY R STBY CR P20601,
OR,2011,074972S,SuperTwo,ROSA OSO HPY TM CNDY OH!P20471,
GA,2013,089102,#2,ROSA SUNROSA TM SOFT PINK,
OR,2013,081502,#2,ROSA SWT SPOT TM PEACH PPAF,
CA,    ,090795ST,#5 STAKED,ROSA-CL-CECILE BRUNNER,
CA,    ,037125ST,#5 STAKED,ROSA-CL-CRIMSON SKY TM PP18564,
CA,    ,051105ST,#5 STAKED,ROSA-CL-EDEN CLIMBER R,
CA,    ,051095ST,#5 STAKED,ROSA-CL-GARDEN SUN TM PPAF,
CA,    ,069445ST,#5 STAKED,ROSA-CL-JOSEPH'S COAT,
CA,2011,075415ST,#5 STAKED,ROSA-CL-SKY'S THE LIMIT TM PAF,
OR,2010,058912,#2,ROSA-CL-WILLIAM BAFFIN,
OR,    ,049405,#5,ACER PAL KAMAGATA,
OR,    ,018345,#5,ACER PAL OSAKAZUKI,
OR,2014,049585,#5,ACER PSEUDO ESKIMO SUNSET,
OR,2010,030335,#5,ACER SHIR AUTUMN MOON,
OR,    ,031555,#5,DAPHNIPHYLLUM MACROPODUM,
OR,    ,025675,#5,DAVIDIA INVOLUCRATA,
OR,    ,006665,#5,HEPTACODIUM MICONIOIDES,
GA,2010,039865,#5,QUERCUS NUTTALLII CHARISMA R,
OR,2014,032985,#5,STYRAX FRAG FOUNTAIN TM P19664,
OR,2011,053125,#5,TROCHODENDRON ARALIOIDES,
OR,2013,056525,#5,ULMUS X FRONTIER,
OR,    ,001495,#5 STAKED,ACTINIDIA KOLOMIKTA,
OR,    ,090681,#1 STAKED,CLEM ALP CONSTANCE,
OR,    ,090661,#1 STAKED,CLEM ALP PAMELA JACKMAN,
OR,2010,038571,#1 STAKED,CLEM ALP STOLWIJK GOLD PP18648,
OR,2011,055392,#2 STAKED,CLEM MONTANA PINK-A-BOO R,
OR,    ,021792,#2 STAKED,CLEM PIILU TM PPAF,
OR,    ,021862,#2 STAKED,CLEM SAPPHIRE INDIGO TMPP17012,
OR,2012,055215,#5 STAKED,CLEM SIEBOLDII,
OR,    ,038002,#2 STAKED,CLEM TEX PRINCESS DIANA,
OR,2010,051485,#5 STAKED,CLEM VANCOUVER TM DANIELLE,
OR,2010,046271,#1 STAKED,CLEM VANCOUVER TM FRGRNT STAR,
OR,2010,048745,#5 STAKED,CLEM VANCOUVER TM STARRY NGHTS,
OR,2010,038081,#1 STAKED,CLEM VIT BETTY CORNING,
OR,    ,033492,#2 STAKED,CLEM X HANIA,
OR,    ,044481,#1 STAKED,CLEM X JACKMANII SUPERBA,
OR,    ,033512,#2 STAKED,CLEM X JULKA,
OR,    ,034432,#2 STAKED,CLEM X KILIAN DONAHUE,
OR,2010,055201,#1 STAKED,CLEM X MRS. SPENCER CASTLE,
OR,2010,056212,#2 STAKED,CLEM X WESTERPLATTE,
GA,    ,038165,#5 STAKED,GELSEMIUM RANKINII,
OR,2013,088395,#5 STAKED,HUMULUS X CRYSTAL,
OR,2013,088405,#5 STAKED,HUMULUS X NEWPORT,
OR,2013,075631,#1 STAKED,HYD INTEG TAIPING SHAN CLIMBNG,
OR,    ,035011,#1 STAKED,HYD PET MIRANDA,
CA,2013,086361S,SuperOne TM,LONICERA P SCENTSATION PP16240,
OR,2013,084395,#5 STAKED,LONICERA PCHES & CREAM PP21839,
OR,    ,059185,#5 STAKED,LONICERA PER BERRIES JUBILEE R,
CA,    ,059275,#5 STAKED,LONICERA X BRO DROPMORE SCARLT,
CA,2012,071961,#1 STAKED,PARTH HENRYANA,
OR,2012,081525,#5 STAKED,PARTH Q RED WALL TM PPAF,
CA,    ,002475,#5 STAKED,PARTH Q STAR SHOWERS R P10128,
GA,    ,002585,#5 STAKED,PARTH TRI GREEN SHOWERS,
