450000,58241,ACHILLEA APRICOT DLGHT PP18738
450000,05824P40,ACHILLEA APRICOT DLGHT PP18738
450000,29061,ACHILLEA MILL RED VELVET
450000,02906P40,ACHILLEA MILL RED VELVET
450000,58251,ACHILLEA STRWBRY SDCTN P18401
450000,1351,ACHILLEA X MOONSHINE
450000,18561,AGASTACHE AUR-HYB TANGO
450000,018561S,AGASTACHE AUR-HYB TANGO
450000,59041,AGASTACHE HEATWAVE PP19662
450000,400521,AGASTACHE HYB BLUE BOA PP24050
450000,400521S,AGASTACHE HYB BLUE BOA PP24050
450000,412511,AGASTACHE KUDOS CORAL PPAF
450000,412521,AGASTACHE KUDOS GOLD PPAF
450000,21251,AGASTACHE X BLUE FORTUNE
450000,84921,AGASTACHE X BOLERO
450000,084921S,AGASTACHE X BOLERO
450000,74122,AGAVE BRACTEOSA CALAMAR
450000,74132,AGAVE DURANGO
450000,25222,AGAVE PARRYI VAR TRUNCATA
450000,08030FLT,AJUGA CHOCOLATE CHIP
450000,08030UT,AJUGA CHOCOLATE CHIP
450000,80301,AJUGA CHOCOLATE CHIP
450000,08030P72,AJUGA CHOCOLATE CHIP
450000,591,AJUGA REPTANS BURGUNDY GLOW
450000,00059P72,AJUGA REPTANS BURGUNDY GLOW
450000,1931,AJUGA REPTANS CATLIN'S GIANT
450000,00193P40,AJUGA REPTANS CATLIN'S GIANT
450000,40055P72,AJUGA REPTANS METALLICA CRISPA
450000,2011,ALCHEMILLA MOLLIS AUSLESE
450000,671,ALCHEMILLA MOLLIS THRILLER
450000,400561,ALLIUM HYB MILLENNIUM
450000,66381,ALST ROCK & ROLL R PP21001
450000,35341,AMSONIA HUBRICHTII
450000,35342,AMSONIA HUBRICHTII
450000,06696UT,ANACYCLUS PYR DEP SILBERKISSEN
450000,06696PS,ANACYCLUS PYR DEP SILBERKISSEN
450000,400602,ANEM PRETTY LADY EMILY P22303
450000,40066UT,ANTENNARIA CARPATICA
450000,05907UT,ANTENNARIA DIOICA RUBRA
450000,37331,AQUILEGIA CAE ORIGAMI BLU & WT
450000,03733BYL,AQUILEGIA CAE ORIGAMI BLU & WT
450000,04592BYL,AQUILEGIA CAE ORIGAMI PNK & WT
450000,03690BYL,AQUILEGIA CAE ORIGAMI RED & WT
450000,03746BYL,AQUILEGIA CAE ORIGAMI ROS & WT
450000,45931,AQUILEGIA CAE ORIGAMI YELLOW
450000,04593BYL,AQUILEGIA CAE ORIGAMI YELLOW
450000,400041,AQUILEGIA GOLDFINCH
450000,59091,AQUILEGIA WINKY DBL RED & WT
450000,40070BYL,ARABIS FER-CO OLD GOLD
450000,40071BYL,ARABIS HYB RED SENSATION
450000,407602,ARALIA CORDATA SUN KING
450000,02576UT,ARMERIA MAR NIFTY THRIFTY
450000,25761,ARMERIA MAR NIFTY THRIFTY
450000,02576P72,ARMERIA MAR NIFTY THRIFTY
450000,01946UT,ARMERIA MAR RUBRIFOLIA
450000,01946P72,ARMERIA MAR RUBRIFOLIA
450000,40073RND,ARMERIA MAR VICTOR REITER
450000,1011,ARTEMISIA SCHM SILVER MOUND
450000,1012,ARTEMISIA SCHM SILVER MOUND
450000,28281,ASCLEPIAS GAY BUTTERFLIES
450000,3152,ASPARAGUS MYERS
450000,30091,ASTER FARMINGTON PPAF
450000,3381,ASTER FRIKARTII MOENCH
450000,412531,ASTER N-A VIBRANT DOME
450000,3411,ASTER PURPLE DOME
450000,23891,ASTER WOOD'S BLUE
450000,1531,ASTER WOOD'S PINK
450000,00159UT,ASTILBE BRIDAL VEIL
450000,412541,ASTILBE DELFT LACE
450000,00350UT,ASTILBE FANAL
450000,3501,ASTILBE FANAL
450000,3502,ASTILBE FANAL
450000,1631,ASTILBE HENNIE GRAAFLAND
450000,1661,ASTILBE JAPONICA PEACH BLOSSOM
450000,1662,ASTILBE JAPONICA PEACH BLOSSOM
450000,413391,ASTILBE LTTLE VISN PRPLPP21855
450000,1681,ASTILBE RED SENTINEL
450000,00353UT,ASTILBE SPRITE
450000,3531,ASTILBE SPRITE
450000,59151,ASTILBE VISION IN PINK PP11860
450000,59152,ASTILBE VISION IN PINK PP11860
450000,16341,ASTILBE VISION IN RED PP11965
450000,16342,ASTILBE VISION IN RED PP11965
450000,17601,ASTILBE VISION IN WHITE P18965
450000,17602,ASTILBE VISION IN WHITE P18965
450000,400811,ASTILBE YOUNIQUE CRM TM P20324
450000,400821,ASTILBE YOUNIQUE SLP TM P20656
450000,23191,ASTRANTIA ABBEY ROAD PP14961
450000,402541S,BAM-FARGESIA DENUDATA
450000,402561S,BAM-FARGESIA NITIDA GREAT WALL
450000,402563,BAM-FARGESIA NITIDA GREAT WALL
450000,025211S,BAM-FARGESIA RUFA (CLUMP)
450000,25213,BAM-FARGESIA RUFA (CLUMP)
450000,402571S,BAM-FARGESIA RUFA GREEN PANDA
450000,402581S,BAM-FARGESIA SCABRIDA
450000,402583,BAM-FARGESIA SCABRIDA
450000,401051S,BAPTISIA DECADENCE R CHRS JUBL
450000,401061,BAPTISIA SOLAR FLARE PP20408
450000,401081,BAPTISIA TWILITE PP19011
450000,22021,BERGENIA COR WINTERGLOW
450000,35381,BRUNNERA MAC JACK FROST P13859
450000,401181,BRUNNERA MAC SILVER HEART PPAF
450000,401475,CAMP INDIAN SUMMER R PP13139
450000,401477PT,CAMP INDIAN SUMMER R PP13139
450000,401477PTLR,CAMP INDIAN SUMMER R PP13139
450000,401447PTLR,CAMP SMR JAZ TANGERINE P23904
450000,401435,CAMP SUMMER JAZZ FIRE P23917
450000,401437PT,CAMP SUMMER JAZZ FIRE P23917
450000,401425,CAMP X SUMMER JAZZ TM GOLD
450000,22351,CAMPANULA CAR DEEP BLUE CLIPS
450000,3891,CAMPANULA CAR WHITE CLIPS
450000,408421,CAMPANULA GLOM GENTI BLUE PPAF
450000,408411,CAMPANULA GLOM GENTI WHITE PAF
450000,40841BYL,CAMPANULA GLOM GENTI WHITE PAF
450000,412915,CAMPSIS RADICANS
450000,068453LR,CELASTRUS SCAN AUTUMN REVOL TM
450000,3961,CENTRANTHUS RUBER COCCINEUS
450000,00396BYL,CENTRANTHUS RUBER COCCINEUS
450000,23481,CERATOSTIGMA PLUMBAGINOIDES
450000,02348P40,CERATOSTIGMA PLUMBAGINOIDES
450000,24191,CHELONE HOT LIPS
450000,412561,CHRY (LEU) REAL CHARMER PPAF
450000,412571,CHRY (LEU) REAL GALAXY PPAF
450000,404471,CHRY (LEUCA) DASY MY TM P21914
450000,407861,CHRY (LEUCA) X REAL GLORY
450000,404522,CHRY (LEUCA) X SUP MONTAUK
450000,40159UT,CHRYS (LEUCANTH) X FREAK PPAF
450000,40159BYL,CHRYS (LEUCANTH) X FREAK PPAF
450000,23021,CHRYS (LEUCANTH) X SUP BECKY
450000,02302P40,CHRYS (LEUCANTH) X SUP BECKY
450000,02661UT,CHRYS (LEUCANTH) X SUP CRAZY
450000,26611,CHRYS (LEUCANTH) X SUP CRAZY
450000,02661BYL,CHRYS (LEUCANTH) X SUP CRAZY
450000,404481,CHRYS (LEUCANTH) X SUP SANTE
450000,4221,CHRYS (LEUCANTH) X SUP SNOWCAP
450000,00422P40,CHRYS (LEUCANTH) X SUP SNOWCAP
450000,39512,CIMI S BLACK NEGLIGEE (ACTAEA)
450000,41454BYL,CLEM BLVRD R CHROKEE TM P24171
450000,41452BYL,CLEM BLVRD R FLEURI TM PP24172
450000,41453BYL,CLEM BLVRD R NINON TM PPAF
450000,41455BYL,CLEM BLVRD R PRSNNE TM PP16069
450000,41456BYL,CLEM BLVRD R REBECCA TM P21583
450000,41457BYL,CLEM BLVRD R ZARA TM PPAF
450000,27472,CLEM PANICULATA
450000,027472LR,CLEM PANICULATA
450000,41460BYL,CLEM RGL R DMANTINA TM PP20638
450000,41461BYL,CLEM RGL R EMPRESS TM P16072
450000,21861,CLEM SAPPHIRE INDIGO TMPP17012
450000,089922S,CLEM SWEET SUMMER LOVE PPAF
450000,48741,CLEM VANCOUVER TM STARRY NGHTS
450000,48741,CLEM VANCOUVER TM STARRY NGHTS
450000,15901,CLEM X BLUE LIGHT R PP15953
450000,27011,CLEM X ERNEST MARKHAM
450000,44481,CLEM X JACKMANII SUPERBA
450000,27441,CLEM X NELLY MOSER
450000,02744BYL,CLEM X NELLY MOSER
450000,27071,CLEM X PINK CHAMPAGNE
450000,401863,COLOCASIA HYB BIKINI-TINI
450000,401883,COLOCASIA LEMON-LIME GECKO
450000,78721,CORE BIGBANG TM CSMC EY P22601
450000,88891,CORE BIGBANG TM MRCRY RSNG PAF
450000,088891S,CORE BIGBANG TM MRCRY RSNG PAF
450000,68081,CORE BIGBANG TM RDSHFT PP20412
450000,18401,CORE CRUZIN' TM BROAD STRT PAF
450000,18421,CORE CRUZIN' TM ELCTRC AVE PAF
450000,18411,CORE CRUZIN' TM MAIN STRT PAF
450000,27911,CORE GRA FLYING SAUCERS P10299
450000,408551,CORE LIL' BANG TM DAYBREAK PAF
450000,408541,CORE LIL' BANG TM RED ELF
450000,408531,CORE LIL' BANG TM STARLIGHT
450000,401911S,COREOPSIS DAZZLESTAR PPAF
450000,48082,COREOPSIS JETHRO TULL PP18789
450000,401921S,COREOPSIS STAR CLUSTER
450000,58261,COREOPSIS VER ROUTE 66 PP20609
450000,27961,COREOPSIS VERT MOONBEAM
450000,27962,COREOPSIS VERT MOONBEAM
450000,02796P40,COREOPSIS VERT MOONBEAM
450000,27971,COREOPSIS VERT ZAGREB
450000,27972,COREOPSIS VERT ZAGREB
450000,02797P40,COREOPSIS VERT ZAGREB
450000,97991,DELOS JWL OF DSRT GARNT P23471
450000,84671,DELOS JWL OF DSRT RUBY P23453
450000,98591,DELOS JWL OF DSRT TOPAZ P23492
450000,78741,DELOSPERMA FIRE SPINNER R
450000,07874P40,DELOSPERMA FIRE SPINNER R
450000,05946UT,DELOSPERMA MESA VERDE PP13876
450000,05946P72,DELOSPERMA MESA VERDE PP13876
450000,75841,DELOSPERMA NUBIGENUM
450000,00459BYL,DELPHINIUM GRAND BLUE MIRROR
450000,00459P32,DELPHINIUM GRAND BLUE MIRROR
450000,402201,DELPHINIUM HYB PAGAN PURPLES
450000,412601,DIAN WHETMAN STARS SUPERNOVA
450000,412601,DIAN WHETMAN STARS SUPERNOVA
450000,29701,DIANTHUS BRILLIANT STAR P13025
450000,59681,DIANTHUS FIRE STAR PP14895
450000,31331,DIANTHUS FROSTY FIRE
450000,4721,DIANTHUS GRAT FIREWITCH
450000,94501,DIANTHUS RASP SURPRISE PP16029
450000,24771,DIANTHUS SPANGLED STAR PP13029
450000,00480UT,DICENTRA BURNINGHEARTS PP20797
450000,4801,DICENTRA BURNINGHEARTS PP20797
450000,00480BYL,DICENTRA BURNINGHEARTS PP20797
450000,402301,DICENTRA IVORY HEARTS P15599
450000,00481UT,DICENTRA KING OF HEARTS
450000,4811,DICENTRA KING OF HEARTS
450000,4901,DICENTRA SP VALENTINE R P22739
450000,00490BYL,DICENTRA SP VALENTINE R P22739
450000,4841,DICENTRA SPECTABILIS
450000,15861,DICENTRA SPECTABILIS ALBA
450000,31611,DICENTRA X LUXURIANT
450000,410422X,DIGITALIS FXLGT TM RBY GLW PAF
450000,85821,DISPORUM CANT MOONLIGHT P24556
450000,85821,DISPORUM CANT MOONLIGHT P24556
450000,64111,ECHEVERIA RUFFLES
450000,402361,ECHIN DBL SCP TM BBLGM PP23103
450000,412611,ECHIN DBL SCP TM CRANBRY PPAF
450000,408612X,ECHIN DBL SCP TM MANDARIN
450000,402351,ECHIN DBL SCP TM RSPBRY P23117
450000,402381S,ECHIN GOLDEN DAZZLE
450000,022281S,ECHIN 'MARMALADE' PPAF
450000,408602X,ECHIN SMBRO TM ADOBE ORNG
450000,97211,ECHIN SMBRO TM FLMNCO ORNG
450000,86821,ECHIN SMBRO TM HOT CORL P23097
450000,086821S,ECHIN SMBRO TM HOT CORL P23097
450000,86841,ECHIN SMBRO TM SALSA RD P23105
450000,7051,ECHIN SUPREME CANTALOUPE PPAF
450000,412621,ECHIN SUPREME FLAMINGO
450000,412621,ECHIN SUPREME FLAMINGO
450000,402411S,ECHIN TANGERINE THRILL
450000,407711,ECHIN VANILLA CUPCAKE
450000,87021,ECHINACEA CHEYENNE SPIRIT
450000,22831,ECHINACEA CRNBRY CUPCAKE PPAF
450000,54441,ECHINACEA FLAME THROWER P21932
450000,37511,ECHINACEA GREEN EYES PP17172
450000,03751BYL,ECHINACEA GREEN EYES PP17172
450000,4892,ECHINACEA KIMS KNEE HI PP12242
450000,38921,ECHINACEA MAC'N CHEESE PP19464
450000,77121,ECHINACEA NOW CHEESIER PPAF
450000,47511,ECHINACEA PNK DBL DLITE P18803
450000,3121,ECHINACEA POWWOW R WHITE
450000,2991,ECHINACEA POWWOW R WILDBERRY
450000,43401,ECHINACEA PRAIRIE SPLENDOR
450000,043401S,ECHINACEA PRAIRIE SPLENDOR
450000,59741,ECHINACEA PUR HOT PAPAYA PPAF
450000,059741S,ECHINACEA PUR HOT PAPAYA PPAF
450000,31771,ECHINACEA PUR MAGNUS
450000,31772,ECHINACEA PUR MAGNUS
450000,032341S,ECHINACEA PUR MERINGUE PPAF
450000,39581,ECHINACEA PUR MERLOT PP18814
450000,18221,ECHINACEA PUR RUBY STAR
450000,18222,ECHINACEA PUR RUBY STAR
450000,33672,ECHINACEA PUR WHITE SWAN
450000,018611S,ECHINACEA SOM SNDY YLW P23104
450000,48651,ECHINACEA TIKI TORCH PP18839
450000,57301,ECHINACEA TOMATO SOUP PPAF
450000,57302,ECHINACEA TOMATO SOUP PPAF
450000,40154RND,ERODIUM REICHARDII ALBUM
450000,40152UT,ERODIUM X BISHOP'S FORM
450000,40153RND,ERODIUM X FLORE PLENO
450000,40153UT,ERODIUM X FLORE PLENO
450000,40248UT,ERYSIMUM KOTS ORANGE FLAME
450000,40248BYL,ERYSIMUM KOTS ORANGE FLAME
450000,402502,EUPATORIUM MAC BABY JOE
450000,40250P40,EUPATORIUM MAC BABY JOE
450000,68111,EUPHORBIA ASCOT RAINBOW PPAF
450000,68112,EUPHORBIA ASCOT RAINBOW PPAF
450000,06811BYL,EUPHORBIA ASCOT RAINBOW PPAF
450000,00501UT,FERN-ADIANTUM HISPIDULUM
450000,32821,FERN-ARACHNIODES STANDISHII
450000,032821S,FERN-ARACHNIODES STANDISHII
450000,021181S,FERN-ATHYRIUM BRANFORD BEAUTY
450000,022061S,FERN-ATHYRIUM BURG LACE P15072
450000,40083UT,FERN-ATHYRIUM F FRIZELLIAE
450000,40083UTLR,FERN-ATHYRIUM F FRIZELLIAE
450000,19241,FERN-ATHYRIUM F LADY IN RED
450000,018761S,FERN-ATHYRIUM GHOST
450000,01876BYL,FERN-ATHYRIUM GHOST
450000,03612UT,FERN-ATHYRIUM NIP PICTUM
450000,36121,FERN-ATHYRIUM NIP PICTUM
450000,036121S,FERN-ATHYRIUM NIP PICTUM
450000,36122,FERN-ATHYRIUM NIP PICTUM
450000,02122UT,FERN-DRYOPTERIS ERY BRILLIANCE
450000,21221,FERN-DRYOPTERIS ERY BRILLIANCE
450000,021221S,FERN-DRYOPTERIS ERY BRILLIANCE
450000,404801,FERN-MATTEUCCIA STRU THE KING
450000,404801S,FERN-MATTEUCCIA STRU THE KING
450000,36411,FERN-OSMUNDA CINNAMOMEA
450000,036411S,FERN-OSMUNDA CINNAMOMEA
450000,083711S,FERN-POLYSTICHUM ACROSTICHOIDS
450000,40263FLT,FRAGARIA X ANA ALLSTAR
450000,402631,FRAGARIA X ANA ALLSTAR
450000,40264FLT,FRAGARIA X ANA CABOT
450000,402641,FRAGARIA X ANA CABOT
450000,40265FLT,FRAGARIA X ANA EARLIGLOW
450000,402651,FRAGARIA X ANA EARLIGLOW
450000,095911X,FRAGARIA X ANA ORUS 2151-2
450000,095921X,FRAGARIA X ANA ORUS 2151-3
450000,095932X,FRAGARIA X ANA ORUS 2153-1
450000,095942X,FRAGARIA X ANA ORUS 2153-5
450000,095951X,FRAGARIA X ANA ORUS 2224-4
450000,095961X,FRAGARIA X ANA ORUS 3233-1
450000,06836FLT,FRAGARIA X SEASCAPE R
450000,68361,FRAGARIA X SEASCAPE R
450000,402902,GAIL GALLO R DRK BICLR P20718
450000,412631,GAILLARDIA FANFARE CITRNLA PAF
450000,412641,GAILLARDIA FANFARE REGAL PPAF
450000,412651,GAILLARDIA SUNSET CANDY PPAF
450000,408811,GAILLARDIA SUNSET CELEBRATION
450000,408761,GAILLARDIA SUNSET CUTIE PPAF
450000,408751,GAILLARDIA SUNSET FLASH PPAF
450000,408801,GAILLARDIA SUNSET SNAPPY PPAF
450000,40880BYL,GAILLARDIA SUNSET SNAPPY PPAF
450000,23831,GALIUM ODORATUM
450000,02383BYL,GALIUM ODORATUM
450000,38241,GERANIUM CIN BALLERINA
450000,408831,GERANIUM MISS HEIDI PPAF
450000,23081,GERANIUM ROZANNE PP12175
450000,5231,GERANIUM SANGUINEUM MAX FREI
450000,38331,GERANIUM X CAN BIOKOVO
450000,21451,GEUM COCC BORISII
450000,35601,GEUM COCC WERNER ARENDS
450000,21261,GEUM X MRS. BRADSHAW
450000,1421,GR-ACORUS GR OGON
450000,00305BYL,GR-ARRHENATHERUM EL VAR
450000,067792LR,GR-BOUT BLOND AMBITION PP22048
450000,067791S,GR-BOUT BLOND AMBITION PP22048
450000,14013,GR-CAL ACUT KARL FOERSTER
450000,14083,GR-CALAMAGROSTIS BRACHYTRICA
450000,065801S,GR-CHASMANTHIUM LAT RIVER MIST
450000,24093,GR-CHASMANTHIUM LATIFOLIUM
450000,89271,GR-CYMBOPOGON CITRATUS
450000,407673,GR-DESCHAMPSIA CAE PIXIE FNTN
450000,31943,GR-ELYMUS ARENARIUS BLUE DUNE
450000,36672,GR-FESTUCA GLAUCA ELIJAH BLUE
450000,36671,GR-FESTUCA GLAUCA ELIJAH BLUE
450000,89291,GR-HAKONECHLOA FUBUKI PP21757
450000,089291SLR,GR-HAKONECHLOA FUBUKI PP21757
450000,35911,GR-HAKONECHLOA MACRA ALL GOLD
450000,03591RP,GR-HAKONECHLOA MACRA ALL GOLD
450000,38681,GR-HAKONECHLOA MACRA AUREOLA
450000,61813,GR-MIS SIN ADAGIO
450000,61813,GR-MIS SIN ADAGIO
450000,61743,GR-MIS SIN CABARET
450000,061743LR,GR-MIS SIN CABARET
450000,61563,GR-MIS SIN GRACILLIMUS
450000,61563,GR-MIS SIN GRACILLIMUS
450000,5522,GR-MIS SIN LITTLE KITTEN
450000,44593,GR-MIS SIN LITTLE ZEBRA P13008
450000,44593,GR-MIS SIN LITTLE ZEBRA P13008
450000,044593LR,GR-MIS SIN LITTLE ZEBRA P13008
450000,61763,GR-MIS SIN PURPURASCENS
450000,61553,GR-MIS SIN STRICTUS
450000,61553,GR-MIS SIN STRICTUS
450000,61573,GR-MIS SIN VARIEGATUS
450000,405003,GR-PAN VIR CHEYENNE SKY
450000,61793,GR-PAN VIR HEAVY METAL
450000,061793LR,GR-PAN VIR HEAVY METAL
450000,22963,GR-PAN VIR NORTHWIND
450000,405023,GR-PAN VIR RUBY RIBBONS P17944
450000,405023LR,GR-PAN VIR RUBY RIBBONS P17944
450000,405063,GR-PENN A DESERT PLAINS P20751
450000,88952,GR-PENN ALO BRGNDY BNNY P21917
450000,405073,GR-PENN ALO FOXTROT
450000,64263,GR-PENN ALO HAMELN
450000,63592,GR-PENN ALO LITTLE BUNNY
450000,405083,GR-PENN ALO RED HEAD
450000,44803,GR-PENN OR KARLEY ROSE PP12909
450000,86113,GR-SCHIZACH BL HEAVN TM P17310
450000,406572,GR-SCHIZACH PRAIRIE BLUES PPAF
450000,406563,GR-SCHIZACHYRIUM CAROUSEL PAF
450000,005793LR,GR-SCHIZACHYRIUM SCO THE BLUES
450000,12082,GR-SPOROBOLUS HETEROLEPIS
450000,03945FLT,HEDERA HELIX
450000,412821,HELENIUM AUT CAN CAN
450000,403011S,HELENIUM BLAZING POPS
450000,25802,HELENIUM MARDI GRAS PP15124
450000,412831,HELENIUM SAHINS EARLY FLOWERER
450000,02445P40,HELIOPSIS LORAINE PP10690
450000,083841S,HELLE NIGER HGC JACOB PP17799
450000,83842,HELLE NIGER HGC JACOB PP17799
450000,89051,HELLE WINDCLIFF DBL PINK SDLNG
450000,89081,HELLE WINDCLIFF SLATY BLUE SDL
450000,096131S,HELLE WJEWELS R AMETHYST GEM
450000,67241,HELLE WJEWELS R APRICOT BLUSH
450000,67281,HELLE WJEWELS R BLACK DIAMOND
450000,67261,HELLE WJEWELS R CHERRY BLOSSOM
450000,068041S,HELLE WJEWELS R COTTON CANDY
450000,65791,HELLE WJEWELS R GOLDEN SUNRISE
450000,67231,HELLE WJEWELS R PAINTED
450000,068061S,HELLE WJEWELS R PAINTED DBLS
450000,39991,HELLE X IVORY PRINCE PP16199
450000,039991S,HELLE X IVORY PRINCE PP16199
450000,39992,HELLE X IVORY PRINCE PP16199
450000,403061S,HELLEBORUS HYB MERLIN
450000,072951S,HELLEBORUS X CINNAMN SNOW PPAF
450000,75491,HELLEBORUS X PICOTEE
450000,072991S,HELLEBORUS X PINK FROST PPAF
450000,409601X,HEM BAKABANA
450000,408211X,HEM BLUSH'N PINK EYE
450000,409611X,HEM BURGUNDY LOVE
450000,409621X,HEM DIVA'S CHOICE
450000,40511,HEM HAPPY RETURNS
450000,40512,HEM HAPPY RETURNS
450000,40071,HEM JOAN SENIOR
450000,40091,HEM LITTLE BUSINESS
450000,40121,HEM LITTLE GRAPETTE
450000,408221X,HEM MAGIC DANCER
450000,409631X,HEM ORANGE NASSUA
450000,40631,HEM PRAIRIE BLUE EYES
450000,409641X,HEM PURPLEICIOUS
450000,59931,HEM ROSY RETURNS
450000,59932,HEM ROSY RETURNS
450000,76281,HEM RUBY SPIDER
450000,04011UT,HEM STELLA DE ORO
450000,40111,HEM STELLA DE ORO
450000,40112,HEM STELLA DE ORO
450000,83931,HEM SWIRLING WATER
450000,409711X,HEM TRIAL VER0176
450000,403201,HEM TROPHYTAKER R NOSFERATU
450000,408231X,HEM VER 0139
450000,408241X,HEM VER 0141
450000,408261X,HEM VER 0286
450000,408271X,HEM VER 0289
450000,54491,HEUCHERA AUTUMN LEAVES PPAF
450000,403231,HEUCHERA BERRY SMOOTHIE P21871
450000,40323BYL,HEUCHERA BERRY SMOOTHIE P21871
450000,03961BYL,HEUCHERA BLACK BEAUTY PP13288
450000,410432X,HEUCHERA CARNIVAL BLK OLIVE
450000,86871,HEUCHERA CARNIVAL COCOMINT PAF
450000,97161,HEUCHERA CARNIVAL PCH PRFT PAF
450000,09716BYL,HEUCHERA CARNIVAL PCH PRFT PAF
450000,87131,HEUCHERA CARNIVAL WATRMELN PAF
450000,87131,HEUCHERA CARNIVAL WATRMELN PAF
450000,403241,HEUCHERA CHERRY COLA P22967
450000,04078UT,HEUCHERA CRIMSON CURLS PP13729
450000,04078BYL,HEUCHERA CRIMSON CURLS PP13729
450000,54911,HEUCHERA FIRE CHIEF PP21880
450000,23101,HEUCHERA FROSTED VIOLET P15085
450000,47531,HEUCHERA GEORGIA PEACH PP19375
450000,04753BYL,HEUCHERA GEORGIA PEACH PP19375
450000,412671,HEUCHERA GRAPE SODA PPAF
450000,18661,HEUCHERA GREEN SPICE
450000,29531,HEUCHERA LIME RICKEY PP16210
450000,28871,HEUCHERA MARMALADE PP15945
450000,02887BYL,HEUCHERA MARMALADE PP15945
450000,45721,HEUCHERA MIDNIGHT ROSE PP18551
450000,04572BYL,HEUCHERA MIDNIGHT ROSE PP18551
450000,37541,HEUCHERA OBSIDIAN PP14836
450000,40451,HEUCHERA PALACE PURPLE
450000,47541,HEUCHERA PEACH FLAMBEE PP17195
450000,40721,HEUCHERA PLUM PUDDING
450000,02165BYL,HEUCHERA SNOW ANGEL
450000,49711,HEUCHERA SOUTHERN COMFORT PPAF
450000,46641,HEUCHERA VIL CARAMEL PP16560
450000,04664BYL,HEUCHERA VIL CARAMEL PP16560
450000,54481,HEUCHERELLA GOLD ZEBRA PPAF
450000,76241,HEUCHERELLA REDSTONE FALLS PAF
450000,407761,HEUCHERELLA SOLAR ECLIPSE
450000,33531,HEUCHERELLA STOPLIGHT PP16835
450000,41171,HEUCHERELLA SWEET TEA PPAF
450000,31871,HOSTA ABIQUA DRINKING GOURD
450000,31872,HOSTA ABIQUA DRINKING GOURD
450000,409651X,HOSTA BEACH BOY
450000,6871,HOSTA BLUE ANGEL
450000,6872,HOSTA BLUE ANGEL
450000,40353UT,HOSTA BLUE MOUSE EARS
450000,403531,HOSTA BLUE MOUSE EARS
450000,16761,HOSTA CHERRY BERRY
450000,409661X,HOSTA COLOR FESTIVAL
450000,409671X,HOSTA COLORED HULK
450000,403611,HOSTA EARTH ANGEL
450000,68241,HOSTA EMPRESS WU PP20774
450000,93061,HOSTA ENTERPRISE
450000,41471,HOSTA EOLA SAPPHIRE
450000,75111,HOSTA FANTASY ISLAND
450000,17491,HOSTA FIRE & ICE
450000,75121,HOSTA FIRE ISLAND
450000,75121,HOSTA FIRE ISLAND
450000,414501X,HOSTA FIRN LINE
450000,42981,HOSTA FIRST FROST
450000,41861,HOSTA FLUCTUANS VARIEG (SAGAE)
450000,41862,HOSTA FLUCTUANS VARIEG (SAGAE)
450000,403491,HOSTA FRAGRANT BOUQUET
450000,403491,HOSTA FRAGRANT BOUQUET
450000,41691,HOSTA FRANCEE
450000,41531,HOSTA GINKO CRAIG
450000,41771,HOSTA GOLDEN PRAYERS
450000,19911,HOSTA GREAT EXPECTATIONS
450000,17521,HOSTA GUACAMOLE
450000,31891,HOSTA HADSPEN BLUE
450000,17531,HOSTA JUNE
450000,41821,HOSTA KROSSA REGAL
450000,414511X,HOSTA MAGIC ISLAND
450000,6981,HOSTA MINUTEMAN
450000,6981,HOSTA MINUTEMAN
450000,28391,HOSTA OLIVE BAILEY LANGDON
450000,28391,HOSTA OLIVE BAILEY LANGDON
450000,40158UT,HOSTA PANDORAS BOX
450000,403561,HOSTA PARADIGM
450000,403561,HOSTA PARADIGM
